{
  "$schema": "http://json-schema.org/draft-07/schema#",
  "title": "Task",
  "type": "object",
  "required": ["id", "list_id", "title", "description", "priority", "owner_id", "reviewer_id", "status", "is_active", "created_at", "updated_at"],
  "properties": {
    "id": { "type": "string", "format": "uuid" },
    "list_id": { "type": "string", "format": "uuid" },
    "title": { "type": "string" },
    "description": { "type": "string" },
    "priority": { "enum": ["urgent", "high", "medium", "low"] },
    "owner_id": { "type": "string", "format": "uuid" },
    "reviewer_id": { "type": "string", "format": "uuid" },
    "started_at": { "type": ["string", "null"] },
    "due_at": { "type": ["string", "null"] },
    "completed_at": { "type": ["string", "null"] },
    "status": { "enum": ["created", "in_progress", "reviewing", "done"] },
    "is_active": { "type": "boolean" },
    "outcome_ids": {
      "type": "array",
      "items": { "type": "string" }
    },
    "created_at": { "type": "string" },
    "updated_at": { "type": "string" }
  }
}
